{"$schema":"https://cdn.jsdelivr.net/gh/forge-arcana/kod-data@main/schema/metals.schema.json","dataset":"metals","base":"USD","unit":"troy_ounce","date":"2026-07-20","updated":"2026-07-20T19:29:53.137Z","sources":["swissquote"],"sourcesMeta":{"swissquote":{"date":"2026-07-20"}},"prices":{"XAU":4011.89,"XAG":56.7015,"XPT":1600.775,"XPD":1261.83}}